{"edp_path":"C:\\Projects\\OMEGA\\Ejercise\\T0P\\collector\\logs_r17\\obj_r17\\s20_mutation_attempts\\qualifier-1791872262031981300\\synthetic_source\\events.edp","edp_sha256":"15f2a81b62eae77e570a3e5e84039db7824f7f5ed6b000b6e54b64905bc39c9e","emon_local_utc_offset_minutes":0,"energy_event":"MSR_EVENT:msr=0x611:type=FREERUN:scope=PACKAGE","energy_semantics":"INTERVAL_DELTA","energy_unit_joule":6.103515625e-05,"event_groups":[["MSR_EVENT:msr=0x606:type=STATIC:scope=PACKAGE","MSR_EVENT:msr=0x611:type=FREERUN:scope=PACKAGE","MSR_EVENT:msr=0x19C:type=STATIC:scope=THREAD","MSR_EVENT:msr=0x1B1:type=STATIC:scope=PACKAGE","CPU_CLK_UNHALTED.THREAD","CPU_CLK_UNHALTED.REF_TSC","INST_RETIRED.ANY","L2_RQSTS.DEMAND_DATA_RD_MISS","L2_RQSTS.ALL_DEMAND_DATA_RD","OFFCORE_REQUESTS.L3_MISS_DEMAND_DATA_RD","OFFCORE_REQUESTS.DEMAND_DATA_RD"]],"event_map_source":"synthetic captured EDP","f_tsc_configured_hz":2500000000,"f_tsc_qpc_hz":2550000000.0,"f_tsc_qualification_qpf_hz":1000000,"f_tsc_qualified_hz":2500000000,"logical_processor_count":24,"lp_map":[{"core_id":0,"core_type":"P","p_core":0,"smt_siblings":[0,1],"worker_lp":0},{"core_id":4,"core_type":"P","p_core":1,"smt_siblings":[2,3],"worker_lp":2},{"core_id":8,"core_type":"P","p_core":2,"smt_siblings":[4,5],"worker_lp":4},{"core_id":12,"core_type":"P","p_core":3,"smt_siblings":[6,7],"worker_lp":6},{"core_id":16,"core_type":"P","p_core":4,"smt_siblings":[8,9],"worker_lp":8},{"core_id":20,"core_type":"P","p_core":5,"smt_siblings":[10,11],"worker_lp":10},{"core_id":24,"core_type":"P","p_core":6,"smt_siblings":[12,13],"worker_lp":12},{"core_id":28,"core_type":"P","p_core":7,"smt_siblings":[14,15],"worker_lp":14}],"marks_clock_domain":"qpc_ticks","mode":"temporal","multiplexing":false,"nominal_window_s":0.05,"periods_lost":0,"profile":"s20","qpf_hz":1000000,"qpf_source":"synthetic QPC fixture","schema_version":"S20-R2-v1","tcc_target_c":100,"thermal_history_clear_at_start":false}
